2024,CONTROLADORIA GERAL,2,AUDITORIA INTERNA PARA O FUTURO,1521,CONTROLADORIA-GERAL DO ESTADO,"PROMOVER O FORTALECIMENTO DOS SERVIÇOS DE AUDITORIA INTERNA PARA A MELHORIA DA COBERTURA DO UNIVERSO AUDITÁVEL DO PODER EXECUTIVO ESTADUAL E PARA O ENFRENTAMENTO DOS NOVOS DESAFIOS A PARTIR DA AMPLIAÇÃO DA CAPACIDADE DE AUDITORIA INTERNA, BASEADA EM PADRÕES INTERNACIONALMENTE RECONHECIDOS, E DA DISPONIBILIZAÇÃO DA INFRAESTRUTURA TECNOLÓGICA NECESSÁRIA PARA AGREGAR MAIOR EFICIÊNCIA E MAIS VALOR À GESTÃO, POR MEIO DO PLANEJAMENTO BASEADO EM RISCOS E DE AÇÕES INTEGRADAS DA CGE E DA SOCIEDADE.",,,,
2024,CONTROLADORIA GERAL,3,ENFRENTAMENTO DA CORRUPÇÃO E RECUPERAÇÃO DE ATIVOS,1521,CONTROLADORIA-GERAL DO ESTADO,"FORTALECER OS MECANISMOS DE PREVENÇÃO, DETECÇÃO E REPRESSÃO A ILÍCITOS ADMINISTRATIVOS E ATOS LESIVOS PRATICADOS, RESPECTIVAMENTE, POR AGENTES PÚBLICOS E  POR PESSOAS JURÍDICAS.",,,,
2024,CONTROLADORIA GERAL,4,CGE INTEGRADA E EFICIENTE,1521,CONTROLADORIA-GERAL DO ESTADO,"DESENVOLVER CAPACIDADES TÉCNICA E INSTITUCIONAL DAS UNIDADES ADMINISTRATIVAS DO ÓRGÃO CENTRAL DA CGE E DAS CONTROLADORIAS SETORIAIS E SECCIONAIS DOS DEMAIS ÓRGÃOS E ENTIDADES DA ADMINISTRAÇÃO DIRETA, AUTÁRQUICA E FUNDACIONAL, POR MEIO DA PADRONIZAÇÃO E DA SIMPLIFICAÇÃO DAS PRÁTICAS ORGANIZACIONAIS E DOS PROCESSOS INTERNOS, DO FORTALECIMENTO DA INTEGRAÇÃO ENTRE AS UNIDADES DA CGE, DA COORDENAÇÃO TÉCNICA DAS CONTROLADORIAS SETORIAIS E SECCIONAIS, DA ATUAÇÃO EM REDE E DO APRIMORAMENTO DA GOVERNANÇA  DE TECNOLOGIA DA INFORMAÇÃO E COMUNICAÇÃO.",,,,
2024,ESCOLA DE SAÚDE PÚBLICA,28,DESENVOLVIMENTO DE AÇÕES DE EDUCAÇÃO E PESQUISA PARA O SISTEMA ÚNICO DE SAÚDE,1541,ESCOLA DE SAÚDE PÚBLICA DO ESTADO DE MINAS GERAIS,"PRODUZIR E DIFUNDIR CONHECIMENTOS JUNTO A TRABALHADORES, GESTORES E AGENTES SOCIAIS QUE ATUAM NO ÂMBITO DO SISTEMA ÚNICO DE SAÚDE (SUS) EM MINAS GERAIS, POR MEIO DE AÇÕES EDUCACIONAIS E DE PESQUISA, TENDO A EDUCAÇÃO PERMANENTE EM SAÚDE COMO REFERENCIAL POLÍTICO-PEDAGÓGICO E CONTRIBUINDO COM A QUALIDADE DOS SERVIÇOS DE SAÚDE PÚBLICA DE MINAS GERAIS.",,,,
2024,GOVERNADORIA,11,ASSESSORAMENTO TÉCNICO E ADMINISTRATIVO AO GOVERNADOR E VICE-GOVERNADOR,1631,SECRETARIA-GERAL,"ASSEGURAR O SUPORTE EFICAZ E INTEGRADO AO GOVERNADOR E AO VICE-GOVERNADOR ATRAVÉS DA COORDENAÇÃO DO ALINHAMENTO INSTITUCIONAL, DA AVALIAÇÃO DE DOCUMENTOS E PRONUNCIAMENTOS, DO GERENCIAMENTO DE CORRESPONDÊNCIAS, DA EXECUÇÃO DE AÇÕES PARA A SIMPLIFICAÇÃO DE NORMAS E DO EXAME E TRAMITAÇÃO DE PROCESSOS ESPECIAIS DE COMPETÊNCIA DO GOVERNADOR.",,,,
2024,COMUNICAÇÃO SOCIAL,18,COMUNICAÇÃO INSTITUCIONAL E DE UTILIDADE PÚBLICA,1711,SECRETARIA DE ESTADO DE COMUNICAÇÃO SOCIAL,"PROMOVER A COMUNICAÇÃO DO GOVERNO COM A SOCIEDADE CIVIL E AMPLIAR O ACESSO ÀS INFORMAÇÕES DE INTERESSE PÚBLICO POR MEIO DA PRESTAÇÃO DE SERVIÇOS E INFORMAÇÕES DAS ASSESSORIAS DE IMPRENSA, PUBLICIDADE E COMUNICAÇÃO DIGITAL.",,,,
2024,CASA CIVIL,131,"ARTICULAÇÃO INTERFEDERATIVA,  ATRAÇÃO DE INVESTIMENTOS, CAPTAÇÃO E TRANSFERÊNCIA DE RECURSOS E PARCERIAS",1721,SECRETARIA DE ESTADO DA CASA CIVIL,"COORDENAR E ARTICULAR AS RELAÇÕES INSTITUCIONAIS DO PODER EXECUTIVO COM GOVERNO FEDERAL, OUTROS PODERES E ENTIDADES NACIONAIS E INTERNACIONAIS, COORDENAR A POLÍTICA DE CAPTAÇÃO DE RECURSOS JUNTO AO PODER EXECUTIVO FEDERAL, DEMAIS ENTES FEDERADOS E ENTIDADES PRIVADAS, ESTIMULAR O DESENVOLVIMENTO SOCIOECONÔMICO NOS MUNICÍPIOS MINEIROS, POR MEIO DA TRANSFERÊNCIA VOLUNTÁRIA DE RECURSOS FINANCEIROS, EM DIÁLOGO COM A ASSEMBLEIA LEGISLATIVA DO ESTADO DE MINAS GERAIS E OBSERVANDO AS DIVERSIDADES E POTENCIALIDADES LOCAIS.",,,,
2024,RESERVA DE CONTINGÊNCIA,999,RESERVA DE CONTINGÊNCIA,1991,RESERVA DE CONTINGÊNCIA,"GARANTIR RECURSOS PARA ABERTURA DE CRÉDITOS ADICIONAIS, TENDO EM CONTA O ATENDIMENTO DE PASSIVOS FISCAIS CONTINGENTES E OUTROS RISCOS E EVENTOS IMPREVISTOS, CONFERINDO UMA MARGEM DE SEGURANÇA PARA O PROCESSO DE EXECUÇÃO ORÇAMENTÁRIA.",,,,
2024,PLANEJAMENTO E GESTÃO,138,"CONCESSÃO DE AUXÍLIO FINANCEIRO, SEGURO E PECÚLIO",2011,INSTITUTO DE PREVIDÊNCIA DOS SERVIDORES DO ESTADO DE MINAS GERAIS,"CONCEDER SEGURO E PECÚLIO AOS SERVIDORES DO ESTADO REGULARMENTE INSCRITOS NO ""PROGRAMA ESTADUAL DE ASSISTÊNCIA AO PECÚLIO DOS SERVIDORES DO ESTADO DE MINAS GERAIS"", E SEUS DEPENDENTES, POR MEIO DO FUNDO DE ASSISTÊNCIA AO PECÚLIO DOS SERVIDORES DO ESTADO DE MINAS GERAIS (FUNAPEC), ALÉM DE CONCEDER AUXÍLIOS FINANCEIROS (NATALIDADE E FUNERAL) AOS BENEFICIÁRIOS DA ASSISTÊNCIA COMPLEMENTAR DO IPSEMG.",,,,
2024,PLANEJAMENTO E GESTÃO,88,SERVIÇOS DE SAÚDE PRESTADOS PELO IPSEMG NA REDE PRÓPRIA,2011,INSTITUTO DE PREVIDÊNCIA DOS SERVIDORES DO ESTADO DE MINAS GERAIS,PRESTAR SERVIÇOS INTEGRADOS DE ATENÇÃO À SAÚDE AOS BENEFICIÁRIOS DA ASSISTÊNCIA À SAÚDE DO IPSEMG NA REDE PRÓPRIA.,,,,
2024,PLANEJAMENTO E GESTÃO,39,GESTÃO DA ASSISTÊNCIA À SAÚDE,2011,INSTITUTO DE PREVIDÊNCIA DOS SERVIDORES DO ESTADO DE MINAS GERAIS,"GERIR A ASSITÊNCIA À SAÚDE PRESTADA AOS BENEFICIÁRIOS DO IPSEMG, COM FINANCIAMENTO SUSTENTÁVEL, POR MEIO DE UMA REDE REGIONALIZADA, HIERARQUIZADA, REGULADA E QUALIFICADA.",,,,
2024,DESENVOLVIMENTO ECONÔMICO,126,EXPLORAÇÃO DE JOGOS LOTÉRICOS E SIMILARES,2041,LOTERIA DO ESTADO DE MINAS GERAIS,"GERIR E EXPLORAR JOGOS LOTÉRICOS E SIMILARES COM O OBJETIVO DE REPASSAR AO ESTADO PARTE DA ARRECADAÇÃO COM AS APOSTAS PARA PROMOÇÃO DO BEM ESTAR SOCIAL E PROGRAMAS (GERENCIADOS PELO GOVERNO ESTADUAL) NAS ÁREAS DE ASSISTÊNCIA, DESPORTOS, EDUCAÇÃO, SAÚDE E DESENVOLVIMENTO SOCIAL.",,,,
2024,PLANEJAMENTO E GESTÃO,91,APRIMORAMENTO DA GESTÃO PÚBLICA POR MEIO DE ENSINO DE EXCELÊNCIA,2061,FUNDAÇÃO JOÃO PINHEIRO,"DESENVOLVER A QUALIDADE DAS AÇÕES GOVERNAMENTAIS, NOS NÍVEIS FEDERAL, ESTADUAL, MUNICIPAL, E QUANDO COUBER NO ÂMBITO DAS ORGANIZAÇÕES DA SOCIEDADE CIVIL, POR MEIO DA FORMAÇÃO, CAPACITAÇÃO E QUALIFICAÇÃO DE PESSOAS, AMPLIANDO AS CAPACIDADES INSTITUCIONAIS DO ESTADO NA GESTÃO DE POLÍTICAS PÚBLICAS MAIS EFETIVAS E NO PROVIMENTO DE SOLUÇÕES INOVADORAS, INCLUSIVAS E DEMOCRÁTICAS PARA OS PROBLEMAS DA SOCIEDADE.",,,,
2024,PLANEJAMENTO E GESTÃO,93,PROMOÇÃO E PRESERVAÇÃO DA MEMÓRIA TÉCNICO-CIENTÍFICA DO ESTADO DE MINAS GERAIS,2061,FUNDAÇÃO JOÃO PINHEIRO,"FACILITAR E AMPLIAR O ACESSO ÀS PUBLICAÇÕES TÉCNICO-CIENTÍFICAS PRODUZIDAS PELAS INSTITUIÇÕES PÚBLICAS ESTADUAIS DE MINAS GERAIS.PROMOVER O RESGATE, REUNIÃO, ARMAZENAMENTO, TRATAMENTO, DISPONIBILIZAÇÃO E DIVULGAÇÃO DO ACERVO DA BIBLIOTECA DIGITAL DE MINAS GERAIS RAYMUNDO NONATO DE CASTRO.PRESERVAR A MEMÓRIA TÉCNICO-CIENTÍFICA DOS ÓRGÃOS E ENTIDADES DA ADMINISTRAÇÃO PÚBLICA DIRETA, AUTÁRQUICA E FUNDACIONAL, NO ÂMBITO DO PODER EXECUTIVO.",,,,
2024,PLANEJAMENTO E GESTÃO,95,ASSESSORIA E PESQUISA EM POLÍTICAS PÚBLICAS,2061,FUNDAÇÃO JOÃO PINHEIRO,"DESENVOLVER CAPACIDADES TÉCNICAS COM O OBJETIVO DE APOIAR A TOMADA DE DECISÃO EM ORGANIZAÇÕES PÚBLICAS, PRIVADAS E DA SOCIEDADE CIVIL, TANTO NO PLANEJAMENTO QUANTO NA GESTÃO, MONITORAMENTOE AVALIAÇÃO DE POLÍTICAS PÚBLICAS.",,,,
2024,PLANEJAMENTO E GESTÃO,96,PRODUÇÃO DE ESTATÍSTICAS E INFORMAÇÕES,2061,FUNDAÇÃO JOÃO PINHEIRO,"PRODUZIR, ANALISAR, DIVULGAR E AVALIAR ESTUDOS TÉCNICO-CIENTÍFICOS E PROJETOS DE PESQUISA APLICADA. APOIAR E FOMENTAR PESQUISAS VOLTADAS PARA O DESENVOLVIMENTO SUSTENTÁVEL DO ESTADO. COORDENAR O SISTEMA ESTADUAL DE ESTATÍSTICA. EXECUTAR OS ESTUDOS ESTADUAIS DE GEOINFORMAÇÃO, COM EXCEÇÃO DOS MAPEAMENTOS DE GEOLOGIA ECONÔMICA.",,,,
2024,DESENVOLVIMENTO ECONÔMICO,22,"CONSTRUINDO O FUTURO POR MEIO DA CIÊNCIA, DA TECNOLOGIA E DA INOVAÇÃO",2071,FUNDAÇÃO DE AMPARO À PESQUISA DO ESTADO DE MINAS GERAIS,"IMPULSIONAR O DESENVOLVIMENTO ECONÔMICO, SOCIAL E AMBIENTAL SUSTENTÁVEL DE MINAS GERAIS, POR MEIO DO FOMENTO À CIÊNCIA, TECNOLOGIA E INOVAÇÃO, PROMOVENDO A EXCELÊNCIA EM PESQUISA, ESTIMULANDO A FORMAÇÃO DE TALENTOS LOCAIS E CRIANDO UM AMBIENTE PROPÍCIO PARA A COLABORAÇÃO ENTRE ACADEMIA, SETOR PRIVADO E SOCIEDADE CIVIL.",,,,
2024,MEIO AMBIENTE E DESENVOLVIMENTO SUSTENTÁVEL,40,RECUPERAÇÃO AMBIENTAL E GESTÃO DE BARRAGENS,2091,FUNDAÇÃO ESTADUAL DO MEIO AMBIENTE,"CONTRIBUIR PARA A MELHORA DA QUALIDADE AMBIENTAL DO ESTADO, POR MEIO DA GESTÃO E RECUPERAÇÃO AMBIENTAL DE ÁREAS DEGRADADAS E CONTAMINADAS.ORIENTAR E SUPERVISIONAR PROCEDIMENTOS DE IDENTIFICAÇÃO, CADASTRO, CONTROLE E REABILITAÇÃO DE ÁREAS CONTAMINADAS POR SUBSTÂNCIAS QUÍMICAS E DEGRADADAS.ORIENTAR E SUPERVISIONAR PROCEDIMENTOS DE IDENTIFICAÇÃO, CADASTRO, CONTROLE E RECUPERAÇÃO DE ÁREAS DEGRADADAS PELA MINERAÇÃO E INSTRUÇÃO E ANÁLISE DOS PROCESSOS ADMINISTRATIVOS DE FECHAMENTO DE MINA.ORIENTAR, MONITORAR E ORGANIZAR O PROCESSO DE APROVAÇÃO E DE IMPLEMENTAÇÃO DOS PAES DAS BARRAGENS DE INDÚSTRIA E DA MINERAÇÃO INCLUÍDAS NA POLÍTICA ESTADUAL DE SEGURANÇA DE BARRAGENS, NO ÂMBITO DE SUA COMPETÊNCIA.",,,,
2024,MEIO AMBIENTE E DESENVOLVIMENTO SUSTENTÁVEL,41,REGULARIZAÇÃO AMBIENTAL,2091,FUNDAÇÃO ESTADUAL DO MEIO AMBIENTE,"EFICIÊNCIA NOS PROCESSOS DE REGULARIZAÇÃO AMBIENTAL, REDUZINDO PRAZOS E AMPLIANDO OFERTA DOS SERVIÇOS.",,,,
2024,MEIO AMBIENTE E DESENVOLVIMENTO SUSTENTÁVEL,31,"PROTEÇÃO DAS ÁREAS AMBIENTALMENTE CONSERVADAS, DA FAUNA E DA BIODIVERSIDADE FLORESTAL",2101,INSTITUTO ESTADUAL DE FLORESTAS,"ORDERNAR E INTENSIFICAR AS ATIVIDADES DE PRESERVAÇÃO, CONSERVAÇÃO, RECUPERAÇÃO E PROTEÇÃO DA DIVERSIDADE BIOLÓGICA, VEGETAL E ANIMAL, E MANTER O EQUILÍBRIO ECOLÓGICO DOS ECOSSISTEMAS DE DOMÍNIO DO ESTADO DE MINAS GERAIS.",,,,
2024,POLÍCIA MILITAR DO ESTADO DE MINAS GERAIS,8,PRESTAÇÃO DE SERVIÇOS PREVIDENCIÁRIOS,2121,INSTITUTO DE PREVIDÊNCIA DOS SERVIDORES MILITARES DO ESTADO DE MINAS GERAIS,"CUSTEAR A PRESTAÇÃO DE BENEFÍCIOS PREVIDENCIÁRIOS - AUXÍLIO NATALIDADE, AUXÍLIO FUNERAL, AUXÍLIO RECLUSÃO E PECÚLIO.",,,,
2024,POLÍCIA MILITAR DO ESTADO DE MINAS GERAIS,6,ASSISTÊNCIA À SAÚDE DOS SEGURADOS E DOS SEUS DEPENDENTES,2121,INSTITUTO DE PREVIDÊNCIA DOS SERVIDORES MILITARES DO ESTADO DE MINAS GERAIS,"DESENVOLVER E APRIMORAR A GESTÃO DA ÁREA DA SAÚDE, NO ÂMBITO DO IPSM, POR MEIO DE INSTRUMENTOS, FERRAMENTAS E AÇÕES, CONTÍNUAS E INOVADORAS, QUE POSSIBILITEM OFERTAR SERVIÇOS DE ASSISTÊNCIA BÁSICA À SAÚDE, EM CONSONÂNCIA COM AS DIRETRIZES DEFINIDAS PELA LEGISLAÇÃO VIGENTE.",,,,
2024,EDUCAÇÃO,42,DESENVOLVIMENTO DA EDUCAÇÃO BÁSICA,2151,FUNDAÇÃO HELENA ANTIPOFF,"ASSEGURAR O DESENVOLVIMENTO DA EDUCAÇÃO BÁSICA COM QUALIDADE, CONFORME OS NÍVEIS RECOMENDÁVEIS NA REDE PÚBLICA ESTADUAL, OBSERVANDO AS DIRETRIZES DA SECRETARIA DE ESTADO DE EDUCAÇÃO - SEE, BEM COMO OS CONCEITOS DA BASE NACIONAL COMUM CURRICULAR (BNCC) E O CURRÍCULO DE REFERÊNCIA DO ESTADO DE MINAS GERAIS.",,,,
2024,EDUCAÇÃO,51,ATENDIMENTO COMUNITÁRIO E PSICOPEDAGOGICO NA FUNDACÃO HELENA ANTIPOFF,2151,FUNDAÇÃO HELENA ANTIPOFF,"CONTRIBUIR PARA A FORMAÇÃO EDUCACIONAL, CULTURAL, SOCIAL E CIDADÃ, BEM COMO PROMOVER O DESENVOLVIMENTO ECONÔMICO, DA COMUNIDADE ESCOLAR, SERVIDORES DA FUNDAÇÃO, COMUNIDADE LOCAL E ENTORNO, POR MEIO DE ATIVIDADES DESENVOLVIDAS NO NÚCLEO DE FORMAÇÃO PRESENCIAL E A DISTÂNCIA - NEAD, CLÍNICA DE PSICOLOGIA ÉDOUARD CLAPARÉDE E OFICINAS PEDAGÓGICAS.",,,,
2024,EDUCAÇÃO,75,AMPLIAÇÃO E MODERNIZAÇÃO DA FUNDAÇÃO HELENA ANTIPOFF,2151,FUNDAÇÃO HELENA ANTIPOFF,"POTENCIALIZAR EM QUANTIDADE E QUALIDADE A DISSEMINAÇÃO DOS CONHECIMENTOS GERADOS NA FUNDAÇÃO HELENA ANTIPOFF, NAS ÁREAS DE CONHECIMENTO EM LINGUAGENS E SUAS TECNOLOGIAS, MATEMÁTICA, CIÊNCIAS DA NATUREZA E CIÊNCIAS HUMANAS E SOCIAIS APLICADAS, AOS EDUCANDOS, ACADÊMICOS, PESQUISADORES E A SOCIEDADE, OBJETIVANDO A FORMAÇÃO DE CIDADÃOS CONSCIENTES DE SUA RESPONSABILIDADE ÉTICA E SOCIAL, ALÉM DE PROPICIAR A ARTICULAÇÃO ENTRE DIFERENTES AGENTES EMPRESARIAIS E GOVERNAMENTAIS.",,,,
2024,EDUCAÇÃO,76,DESENVOLVIMENTO DA EDUCAÇÃO PROFISSIONAL TÉCNICA,2151,FUNDAÇÃO HELENA ANTIPOFF,"O PROGRAMA VISA FORMAR CIDADÃO PARA ATENDER O MUNDO DO TRABALHO, FOMENTANDO OS ARRANJOS PRODUTIVOS LOCAIS, BEM COMO A FORMAÇÃO HUMANÍSTICA E A INSERÇÃO NA VIDA EM SOCIEDADE.",,,,
2024,EDUCAÇÃO,89,"MEMÓRIA VIVA: DIFUSÃO CULTURAL, PATRIMÔNIO MATERIAL E IMATERIAL",2151,FUNDAÇÃO HELENA ANTIPOFF,"GARANTIR À SOCIEDADE O EXERCÍCIO DO DIREITO À IDENTIDADE CULTURAL, DIFUNDINDO O LEGADO ANTIPOFFIANO, NA MODALIDADE PRESENCIAL E A DISTÂNCIA, ALÉM DISSO, PROMOVER A IDENTIFICAÇÃO, A DOCUMENTAÇÃO E A PRESERVAÇÃO DOS BENS CULTURAIS MATERIAIS E IMATERIAIS , ASSEGURANDO SUA PERMANÊNCIA, USUFRUTO E AQUISIÇÃO DE NOVOS USOS E SIGNIFICADOS POR PARTE DAS GERAÇÕES ATUAIS E FUTURAS.",,,,
2024,EDUCAÇÃO,104,ENFRENTAMENTO À VULNERABILIDADE NOS TERRITÓRIOS DE ATUAÇÃO DA FUCAM,2161,FUNDAÇÃO EDUCACIONAL CAIO MARTINS,"ENFRENTAR A SITUAÇÃO DE VULNERABILIDADE SOCIAL E ECONÔMICA NOS MUNICÍPIOS DE ATUAÇÃO DA FUNDAÇÃO EDUCACIONAL CAIO MARTINS POR MEIO DA OFERTA DA EDUCAÇÃO BÁSICA E PROFISSIONAL DE QUALIDADE E DA EXECUÇÃO DE AÇÕES EFETIVAS DE INCLUSÃO SOCIOPRODUTIVA, CONSIDERANDO AS PARTICULARIDADES LOCAIS, A PROTEÇÃO DO MEIO AMBIENTE, O ATINGIMENTO DOS OBJETIVOS DE DESENVOLVIMENTO SUSTENTÁVEL (ODS, AGENDA 2030 DA ORGANIZAÇÃO DAS NAÇÕES UNIDAS) DE NÚMEROS 1.1, 1.2, 1.4, 2.3, 2.4, 4.1, 4.3, 4.4, 4.7 E 8.3.",,,,
2024,MEIO AMBIENTE E DESENVOLVIMENTO SUSTENTÁVEL,65,FORTALECIMENTO DA POLÍTICA ESTADUAL DE RECURSOS HÍDRICOS,2241,INSTITUTO MINEIRO DE GESTÃO DAS ÁGUAS,"A POLÍTICA ESTADUAL DE RECURSOS HÍDRICOS VISA ASSEGURAR O CONTROLE DO USO DA ÁGUA E DE SUA UTILIZAÇÃO EM QUANTIDADE E QUALIDADE SATISFATÓRIOS. PARA QUE A POLÍTICA POSSA SER PRESTADA, TEM-SE OS 9 (NOVE) INSTRUMENTOS QUE O PROGRAMA VISA AMPLIAR PARA QUE SE OBTENHA MAIORES RESULTADOS. ALÉM DOS INSTRUMENTOS HÁ FERRAMENTAS APLICADAS PARA MELHOR EFETIVAÇÃO DA POLÍTICA.",,,,
2024,DESENVOLVIMENTO ECONÔMICO,29,REGISTRO PÚBLICO DE EMPRESAS MERCANTIS E ATIVIDADES AFINS,2251,JUNTA COMERCIAL DO ESTADO DE MINAS GERAIS,"DESBUROCRATIZAR, RACIONALIZAR, MODERNIZAR E SIMPLIFICAR O REGISTRO DOS EMPRESÁRIOS, DAS SOCIEDADES EMPRESÁRIAS, DAS SOCIEDADES COOPERATIVAS E CONSÓRCIOS BEM COMO SINCRONIZAR DADOS COM OUTROS ÓRGÃOS VISANDO A UNIFICAÇÃO DE DADOS CADASTRAIS, AUTENTICAR OS INSTRUMENTOS DE ESCRITURAÇÃO DAS EMPRESAS E SOCIEDADES REGISTRADAS E EXPEDIR CERTIDÕES DOS DOCUMENTOS ARQUIVADOS.",,,,
2024,SAÚDE,152,INOVAÇÃO CIENTÍFICA E TECNOLÓGICA,2261,FUNDAÇÃO EZEQUIEL DIAS,"GERAR PRODUTOS TECNOLÓGICOS INOVADORES, VISANDO A INCORPORAÇÃO DE NOVOS PRODUTOS E SERVIÇOS NO COMPLEXO ECONÔMICO E INDUSTRIAL DA SAÚDE E TRANSFERÊNCIAS DE TECNOLOGIAS PARA OUTRAS ICTS E EMPRESAS PRIVADAS, POR MEIO DO DESENVOLVIMENTO DE PROTÓTIPOS, DA PRODUÇÃO DE LOTES PILOTO PARA REGISTRO E/OU DA REALIZAÇÃO DE ENSAIOS CLÍNICOS VOLTADOS À SAÚDE PÚBLICA. FORMAR RECURSOS HUMANOS ALTAMENTE QUALIFICADOS PARA ATUAÇÃO EM SETORES PRODUTIVOS E INSTITUIÇÕES DE CIÊNCIA E TECNOLOGIA QUE SERÃO CAPAZES DE CONTRIBUIR PARA O DESENVOLVIMENTO DE PRODUTOS, PROCESSOS E NOVAS TÉCNICAS DE ANÁLISE E DIAGNÓSTICO DE BASE BIOTECNOLÓGICA.",,,,
2024,SAÚDE,153,VIGILÂNCIA LABORATORIAL EM SAÚDE PÚBLICA,2261,FUNDAÇÃO EZEQUIEL DIAS,"PROMOVER AÇÕES DE VIGILÂNCIA LABORATORIAL EM SAÚDE PÚBLICA COM BASE NA ANÁLISE PERMANENTE DOS CENÁRIOS EPIDEMIOLÓGICO, AMBIENTAL, SANITÁRIO E DA SAÚDE DO TRABALHADOR, VISANDO AÇÕES DE PREVENÇÃO, TRATAMENTO E CONTROLE DE RISCOS E DANOS À SAÚDE DA POPULAÇÃO, O QUE INCLUI TANTO A ABORDAGEM INDIVIDUAL COMO COLETIVA.",,,,
2024,SAÚDE,154,DESENVOLVIMENTO E PRODUÇÃO DE MEDICAMENTOS PARA O SISTEMA ÚNICO DE SAÚDE (SUS),2261,FUNDAÇÃO EZEQUIEL DIAS,"DESENVOLVER, PRODUZIR E FORNECER MEDICAMENTOS SINTÉTICOS DE INTERESSE A SAÚDE PÚBLICA, DE FORMA A ATENDER AS DIRETRIZES DA POLÍTICA NACIONAL DE ASSISTÊNCIA FARMACÊUTICA, PRINCIPALMENTE NO TOCANTE ÀS NECESSIDADES DE TRATAMENTO DE AGRAVOS E DOENÇAS DA POPULAÇÃO BRASILEIRA, BEM COMO MEDICAMENTOS BIOLÓGICOS PARA O SUS, OBJETIVANDO A PREVENÇÃO DE DOENÇAS GRAVES E TRATAMENTO DE ACIDENTES COM ANIMAIS PEÇONHENTOS.",,,,
2024,SAÚDE,150,UNIVERSALIZAÇÃO DO ACESSO AO CONHECIMENTO CIENTÍFICO E TECNOLÓGICO,2261,FUNDAÇÃO EZEQUIEL DIAS,"PROMOVER A UNIVERSALIZAÇÃO DO ACESSO AO CONHECIMENTO CIENTÍFICO E TECNOLÓGICO, DE FORMA A GARANTIR INCLUSÃO SOCIAL, CIDADANIA E EQUIDADE. FOMENTAR A INTERAÇÃO ENTRE A COMUNIDADE CIENTÍFICA E O PÚBLICO EM GERAL. DEMOCRATIZAR O CONHECIMENTO E A CULTURA CIENTÍFICA-TECNOLÓGICA EM TODO O ESTADO DE MINAS GERAIS.",,,,
2024,SAÚDE,19,ATENÇÃO HOSPITALAR ESPECIALIZADA,2271,FUNDAÇÃO HOSPITALAR DO ESTADO DE MINAS GERAIS,"ATUAR COMO REFERÊNCIA ESTRATÉGICA NOS ATENDIMENTOS DE MÉDIA E ALTA COMPLEXIDADE HOSPITALAR NO SISTEMA ÚNICO DE SAÚDE – SUS, POR MEIO DE 19 UNIDADES ASSISTENCIAIS, QUAIS SEJAM: COMPLEXO HOSPITALAR DE URGÊNCIA E EMERGÊNCIA, COMPOSTO PELAS UNIDADES HOSPITAL INFANTIL JOÃO PAULO II, HOSPITAL JOÃO XXIII E HOSPITAL MARIA AMÉLIA LINS, COMPLEXO HOSPITALAR DE BARBACENA, COMPOSTO PELAS UNIDADES HOSPITAL REGIONAL DE BARBACENA DR. JOSÉ AMÉRICO E CENTRO HOSPITALAR PSIQUIÁTRICO DE BARBACENA, COMPLEXO HOSPITALAR DE ESPECIALIDADES, COMPOSTO PELAS UNIDADES HOSPITAL ALBERTO CAVALCANTI E HOSPITAL JÚLIA KUBITSCHEK, HOSPITAL REGIONAL ANTÔNIO DIAS, HOSPITAL REGIONAL JOÃO PENIDO, MATERNIDADE ODETE VALADARES, HOSPITAL EDUARDO DE MENEZES, CENTRO MINEIRO DE TOXICOMANIA, CENTRO PSÍQUICO DA ADOLESCÊNCIA E INFÂNCIA, INSTITUTO RAUL SOARES, CASA DE SAÚDE PADRE DAMIÃO, CASA DE SAÚDE SANTA FÉ, CASA DE SAÚDE SANTA IZABEL, CASA DE SAÚDE SÃO FRANCISCO DE ASSIS, HOSPITAL CRISTIANO MACHADO. AS UNIDADES ESTÃO LOCALIZADAS NOS MUNICÍPIOS DE BAMBUÍ, BARBACENA, BELO HORIZONTE, BETIM, JUIZ DE FORA, PATOS DE MINAS, SABARÁ, TRÊS CORAÇÕES E UBÁ.ADEMAIS, A FHEMIG, POR MEIO DO MG TRANSPLANTES, TEM COMO OBJETIVO COORDENAR ATIVIDADES DE TRANSPLANTES NO ÂMBITO DE ESTADO DE MINAS GERAIS, PROMOVENDO ESTRATÉGIAS E CAMPANHAS COM OBJETIVO DE AUMENTAR A CAPTAÇÃO DE ÓRGÃOS E TECIDOS. O MG TRANSPLANTES É COMPOSTO PELA CENTRAL ESTADUAL DE TRANSPLANTES - CET E POR 7 ORGANIZAÇÕES DE PROCURA DE ÓRGÃOS - OPO, LOCALIZADAS NOS MUNICÍPIOS DE BELO HORIZONTE, GOVERNADOR VALADARES, IPATINGA, POUSO ALEGRE, JUIZ DE FORA, MONTES CLAROS E UBERLÂNDIA.",,,,
2024,"INFRAESTRUTURA, MOBILIDADE E PARCERIAS",81,DESENVOLVIMENTO SUSTENTÁVEL DA INFRAESTRUTURA RODOVIÁRIA,2301,DEPARTAMENTO DE EDIFICAÇÕES E ESTRADAS DE RODAGEM DO ESTADO DE MINAS GERAIS,"DESENVOLVER E MANTER UMA INFRAESTRUTURA RODOVIÁRIA DE QUALIDADE, CONFIÁVEL E SUSTENTÁVEL, APOIANDO O DESENVOLVIMENTO ECONÔMICO E O BEM-ESTAR DOS USUÁRIOS",,,,
2024,EDUCAÇÃO,7,EDUCAÇÃO SUPERIOR,2311,UNIVERSIDADE ESTADUAL DE MONTES CLAROS,"PROMOVER O ACESSO À EDUCAÇÃO PROFISSIONAL E TECNOLÓGICA E À EDUCAÇÃO SUPERIOR DE QUALIDADE, COM ESTÍMULO PERMANENTE AO DESENVOLVIMENTO TÉCNICO, CIENTÍFICO, ARTÍSTICO, CULTURAL E DE INOVAÇÃO, VISANDO CONTRIBUIR COM O DESENVOLVIMENTO SOCIAL E ECONÔMICO DO ESTADO",,,,
2024,SAÚDE,87,"ASSISTÊNCIA EM HEMATOLOGIA, HEMOTERAPIA,CÉLULAS E TECIDOS BIOLÓGICOS",2321,FUNDAÇÃO CENTRO DE HEMATOLOGIA E HEMOTERAPIA DE MINAS GERAIS,"EXECUTAR AS DIRETRIZES ESTABELECIDAS PELA POLÍTICA ESTADUAL DE SAÚDE EM RELAÇÃO À HEMOTERAPIA, HEMATOLOGIA, CÉLULAS E TECIDOS BIOLÓGICOS. OFERTANDO E COORDENANDO A PRODUÇÃO E DISTRIBUIÇÃO DE HEMOCOMPONENTES, HEMODERIVADOS E CÉLULAS/TECIDOS À REDE PÚBLICA E ESTABELECIMENTOS DE SAÚDE CONTRATANTES. REALIZAR ATENDIMENTO AMBULATORIAL COM EQUIPE MULTIDICIPLINAR A PACIENTES PORTADORES DE COAGULOPATIAS E HEMOGLOBINOPATIAS HEREDITÁRIAS, FORNECER BOLSAS DE PLASMA PARA PRODUÇÃO DE HEMODERIVADOS EM CONSONÂNCIA COM AS DIRETRIZES ESTABELECIDAS, REALIZAR TREINAMENTO DOS FUNCIONÁRIOS E EQUIPES DAS AGÊNCIAS TRANSFUSIONAIS DOS HOSPITAIS CONVENIADOS VISANDO MELHORIA CONTÍNUA E AMPLIAÇÃO DA COBERTURA DOS SERVIÇOS NAS RESPECTIVAS ÁREAS.",,,,
2024,PLANEJAMENTO E GESTÃO,12,POLÍTICA PÚBLICA DE METROLOGIA E AVALIAÇÃO DA CONFORMIDADE,2331,INSTITUTO DE METROLOGIA E QUALIDADE DO ESTADO DE MINAS GERAIS,"SER RECONHECIDO COMO UM ÓRGÃO DE REFERÊNCIA NACIONAL EM METROLOGIA, AVALIAÇÃO DA CONFORMIDADE, FISCALIZAÇÃO DE PRODUTOS E SERVIÇOS, ATENDENDO COM EXCELÊNCIA ÀS NECESSIDADES DA SOCIEDADE, DISPONDO DE AUTONOMIA DE GESTÃO. TRABALHAR DECISIVAMENTE EM METROLOGIA E AVALIAÇÃO DA CONFORMIDADE, ACOMPANHANDO O AVANÇO TECNOLÓGICO PARA A MELHORIA DA QUALIDADE DE VIDA DA POPULAÇÃO, EM ESPECIAL NAS ÁREAS DA SAÚDE, SEGURANÇA, MEIO AMBIENTE E DEFESA DO CONSUMIDOR, CONTRIBUINDO ASSIM, PARA UM ESTADO MAIS COMPETITIVO E INCENTIVADOR DO EMPREENDEDORISMO EM INDÚSTRIA, INSUMOS E SERVIÇOS, PROPICIANDO AMBIENTE PARA MAIOR E SUSTENTÁVEL GERAÇÃO DE EMPREGO E RENDA.",,,,
2024,EDUCAÇÃO,26,DESENVOLVIMENTO DO ENSINO SUPERIOR NA UEMG,2351,UNIVERSIDADE DO ESTADO DE MINAS GERAIS,"PROMOVER O DESENVOLVIMENTO TÉCNICO, CIENTÍFICO, ARTÍSTICO E CULTURAL, PRIORITARIAMENTE, NAS REGIÕES DO ESTADO ONDE A UEMG POSSUI UNIDADES ACADÊMICAS, POR MEIO DA OFERTA DE FORMAÇÃO DE ENSINO SUPERIOR DE QUALIDADE BEM COMO DA REALIZAÇÃO DE PESQUISAS DE INTERESSE SOCIAL E PRESTAÇÃO DE SERVIÇOS À SOCIEDADE.",,,,
2024,ASSEMBLEIA LEGISLATIVA,766,BENEFÍCIOS ASSISTENCIAIS,2361,INSTITUTO DE PREVIDÊNCIA DO LEGISLATIVO DO ESTADO DE MINAS GERAIS,"CUSTEAR A PRESTAÇÃO DE BENEFÍCIOS PREVIDENCIÁRIOS EM GERAL, EXCETO PENSÃO AOS SEGURADOS, DEPENDENTES E PENSIONISTAS.",,,,
2024,ASSEMBLEIA LEGISLATIVA,767,RESERVA DE BENEFÍCIOS,2361,INSTITUTO DE PREVIDÊNCIA DO LEGISLATIVO DO ESTADO DE MINAS GERAIS,"GARANTIR AOS SEGURADOS, DEPENDENTES, OUTROS CIVIS E PENSIONISTAS PAGAMENTO DOS BENEFÍCIOS CONCEDIDOS E A CONCEDER, MEDIANTE A CONSTITUIÇÃO E MANUTENÇÃO DE RESERVA TÉCNICA PREVISTA EM LAUDO ATUARIAL.",,,,
2024,"AGRICULTURA, PECUÁRIA E ABASTECIMENTO",78,DEFESA SANITÁRIA,2371,INSTITUTO MINEIRO DE AGROPECUÁRIA,"PRESERVAR A SANIDADE DOS ANIMAIS E DOS VEGETAIS POR MEIO DO CONTROLE E A ERRADICAÇÃO DE PRAGAS E DOENÇAS, O CONTROLE DO COMÉRCIO E DO USO DE AGROTÓXICOS E AFINS, O COMÉRCIO DE SEMENTES E MUDAS E DE PRODUTOS DE USO VETERINÁRIO VISANDO AUMENTAR A PRODUÇÃO E A PRODUTIVIDADE, PRESERVAR A SAÚDE PÚBLICA E O MEIO AMBIENTE.",,,,
2024,"AGRICULTURA, PECUÁRIA E ABASTECIMENTO",80,SEGURANÇA DE ALIMENTOS,2371,INSTITUTO MINEIRO DE AGROPECUÁRIA,GARANTIR A OFERTA DE ALIMENTOS SEGUROS REALIZANDO A INSPEÇÃO E A FISCALIZAÇÃO DA QUALIDADE E DA ORIGEM DOS PRODUTOS AGROPECUÁRIOS E AGROINDUSTRIAIS.,,,,
2024,DESENVOLVIMENTO SOCIAL,56,DESENVOLVIMENTO DA INFRAESTRUTURA DO NORTE E NORDESTE DE MINAS GERAIS,2421,INSTITUTO DE DESENVOLVIMENTO DO NORTE E NORDESTE DE MINAS GERAIS,"PROMOVER O DESENVOLVIMENTO SOCIOECONÔMICO DA REGIÃO, POR MEIO DO ACESSO À INFRAESTRUTURA, ESPECIALMENTE O ACESSO A RECURSOS HÍDRICOS, TANTO PARA CONSUMO QUANTO PARA PRODUÇÃO ECONÔMICA. ALÉM DE CRIAR AS CONDIÇÕES NECESSÁRIAS PARA A ATRAÇÃO DE INVESTIMENTOS E O DESENVOLVIMENTO DO EMPREENDEDORISMO LOCAL.",,,,
2024,DESENVOLVIMENTO SOCIAL,124,PROMOÇÃO DO DESENVOLVIMENTO DO NORTE E NORDESTE DE MINAS GERAIS,2421,INSTITUTO DE DESENVOLVIMENTO DO NORTE E NORDESTE DE MINAS GERAIS,"PROMOVER O DESENVOLVIMENTO SOCIOECONÔMICO DA REGIÃO POR MEIO DA IMPLANTAÇÃO DE AÇÕES QUE VISEM SANAR VULNERABILIDADES SOCIAIS, PROMOVER A GERAÇÃO DE RENDA, INCREMENTAR A PRODUTIVIDADE AGRÍCOLA E O DESENVOLVIMENTO DA AGRICULTURA FAMILIAR E ESTABELECER PARCERIAS PARA FORTALECER AS VOCAÇÕES REGIONAIS.",,,,
2024,MEIO AMBIENTE E DESENVOLVIMENTO SUSTENTÁVEL,10,REGULAÇÃO E FISCALIZAÇÃO DOS SERVIÇOS DE ABASTECIMENTO DE ÁGUA E DE ESGOTAMENTO SANITÁRIO E ATENDIMENTO AOS USUÁRIOS,2441,AGÊNCIA REGULADORA DE SERVIÇOS DE ABASTECIMENTO DE ÁGUA E DE ESGOTAMENTO SANITÁRIO DO ESTADO DE MINAS GERAIS,"REGULAR E FISCALIZAR OS SERVIÇOS DE ABASTECIMENTO DE ÁGUA E DE ESGOTAMENTO SANITÁRIO BUSCANDO O EQUILÍBRIO E QUALIDADE NA PRESTAÇÃO DOS SERVIÇOS, DO PONTO DE VISTA TÉCNICO-OPERACIONAL E ECONÔMICO-FINANCEIRO, PRESTANDO ATENDIMENTO AOS USUÁRIOS",,,,
2024,"AGRICULTURA, PECUÁRIA E ABASTECIMENTO",90,ASSISTÊNCIA TECNICA E EXTENSÃO RURAL PARA O ESTADO DE MINAS GERAIS,3041,EMPRESA DE ASSISTÊNCIA TÉCNICA E EXTENSÃO RURAL DO ESTADO DE MINAS GERAIS,"PRESTAR ASSISTÊNCIA TÉCNICA E EXTENSÃO RURAL AOS PRODUTORES RURAIS E DEMAIS PÚBLICOS RELACIONADOS À PRODUÇÃO AGROPECUÁRIA, COM INFORMAÇÕES TÉCNICAS QUE POSSIBILITEM A OFERTA DE ALIMENTOS, AGREGAÇÃO DE VALOR À PRODUÇÃO, ACESSO AO MERCADO, PROMOÇÃO DE MELHORIA NO SANEAMENTO RURAL E À PRESERVAÇÃO E/OU RECUPERAÇÃO DOS RECURSOS NATURAIS.",,,,
2024,"AGRICULTURA, PECUÁRIA E ABASTECIMENTO",97,MINAS SEM FOME,3041,EMPRESA DE ASSISTÊNCIA TÉCNICA E EXTENSÃO RURAL DO ESTADO DE MINAS GERAIS,"PROMOVER FOMENTO AGROPECUÁRIO, CONTRIBUINDO PARA A INCLUSÃO, NO PROCESSO PRODUTIVO, DE AGRICULTORES E SUAS FORMAS DE ORGANIZAÇÃO, BEM COMO DA POPULAÇÃO RURAL EM SITUAÇÃO DE MAIOR VULNERABILIDADE, ABRANGENDO AÇÕES VOLTADAS PARA A PRODUÇÃO DE ALIMENTOS E GERAÇÃO DE RENDA, VISANDO A MELHORIA DAS CONDIÇÕES DE SEGURANÇA E SOBERANIA ALIMENTAR E NUTRICIONAL.",,,,
2024,"AGRICULTURA, PECUÁRIA E ABASTECIMENTO",15,ENSINO SUPERIOR PARA A AGRICULTURA E PECUÁRIA,3051,EMPRESA DE PESQUISA AGROPECUÁRIA DE MINAS GERAIS,"CAPACITAR TÉCNICA E GERENCIALMENTE PESSOAS PARA ATUAREM NA AGROINDÚSTRIA DO LEITE E DERIVADOS E NO SETOR COOPERATIVISTA DO AGRONEGÓCIO E DA AGRICULTURA FAMILIAR, COM VISTAS À MELHORIA DA QUALIDADE DOS PRODUTOS E AO AUMENTO DA RENDA.",,,,
