2024,CULTURA E TURISMO,105,FORMAÇÃO E CAPACITAÇÃO TÉCNICO-CULTURAL,1271,SECRETARIA DE ESTADO DE CULTURA E TURISMO,"PROMOVER E FORTALECER A PROFISSIONALIZAÇÃO DAS ATIVIDADES ARTÍSTICO-CULTURAIS DO ESTADO E O FOMENTO DA CADEIA PRODUTIVA DA CULTURA, COM ESTRATÉGIAS, AÇÕES E POLÍTICAS PÚBLICAS ADEQUADAS À DINÂMICA DE CADA ÁREA, INCENTIVANDO E APOIANDO SUA DESCENTRALIZAÇÃO E REGIONALIZAÇÃO. QUALIFICAR E FORMAR PROFISSIONAIS NO CAMPO DAS ARTES, CONSERVAÇÃO E RESTAURAÇÃO DE BENS MÓVEIS, INTEGRADOS E IMÓVEIS, DE OFÍCIOS TRADICIONAIS E CONTEMPORÂNEOS, ALÉM DE SERVIDORES PÚBLICOS E POPULAÇÃO, ATUANTES NA PRODUÇÃO CULTURAL E ECONOMIA CRIATIVA. OFERECER CURSOS COMPLEMENTARES, LIVRES, DE FORMAÇÃO INICIAL E CONTINUADA, BEM COMO TÉCNICOS NAS ÁREAS DE ARTES VISUAIS, DANÇA, MÚSICA, TEATRO, TECNOLOGIA DA CENA, AUDIOVISUAL, PRESERVAÇÃO, CONSERVAÇÃO E RESTAURAÇÃO DO PATRIMÔNIO CULTURAL.AMPLIAR O ALCANCE DAS AÇÕES CULTURAIS, SUBSIDIANDO E ORIENTANDO O DESENVOLVIMENTO, APRIMORAMENTO E INCREMENTO DAS ATIVIDADES CULTURAIS EM TODO O ESTADO, DISSEMINANDO INFORMAÇÕES E GARANTINDO O FORTALECIMENTO E A PROFISSIONALIZAÇÃO DA PRODUÇÃO CULTURAL E ARTÍSTICA NO ESTADO.PROMOVER O APERFEIÇOAMENTO DA GESTÃO, PROTEÇÃO, SALVAGUARDA, VALORIZAÇÃO E USUFRUTO DO PATRIMÔNIO CULTURAL.PROMOVER RESIDÊNCIAS ARTÍSTICAS E CURSOS DE APERFEIÇOAMENTO NO CAMPO DE PESQUISA EM ARTES E EM TODAS AS LINGUAGENS ARTÍSTICAS. VIABILIZAR A MOBILIZAÇÃO DE RECURSOS HUMANOS, MATERIAIS E FINANCEIROS PARA FORTALECIMENTO E OTIMIZAÇÃO DE AÇÕES QUALIFICADAS POR MEIO DE PARCERIAS COM ORGANIZAÇÕES PÚBLICAS E PRIVADAS.",,,,
2024,CULTURA E TURISMO,106,PROTEÇÃO E SALVAGUARDA DE ACERVOS E BENS CULTURAIS,1271,SECRETARIA DE ESTADO DE CULTURA E TURISMO,"GERIR E PRESERVAR OS ACERVOS ARQUIVÍSTICOS, BIBLIOGRÁFICOS E MUSEOLÓGICOS, IMPLEMENTADO TECNOLOGIAS ASSISTIVAS, VISANDO APRIMORAR OS SERVIÇOS PRESTADOS A POPULAÇÃO DE FORMA ACESSÍVEL.  OTIMIZAR A GESTÃO DE DOCUMENTOS NOS ÓRGÃOS DO PODER EXECUTIVO DO ESTADO DE MINAS GERAIS GARANTINDO O CONTROLE EFETIVO DA PRODUÇÃO, CLASSIFICAÇÃO, TRAMITAÇÃO, USO, AVALIAÇÃO, DESTINAÇÃO, PRESERVAÇÃO E ACESSO AOS DOCUMENTOS PÚBLICOS E PRIVADOS DE INTERESSE PÚBLICO PARA O REGISTRO DA MEMÓRIA E APOIO AO DESENVOLVIMENTO DE POLÍTICAS PÚBLICAS. GARANTIR O DIREITO DA SOCIEDADE À IDENTIDADE CULTURAL, PROMOVENDO A PRESERVAÇÃO DE BENS MATERIAIS E IMATERAIS REPRESENTATIVOS DA CULTURA MINEIRA EM SUAS DIVERSAS MANIFESTAÇÕES, CONTEXTOS E ÉPOCAS, POR MEIO DE UMA POLÍTICA DE PRESERVAÇÃO EFETIVA ENVOLVENDO BENS DE VALOR HISTÓRICO, ARTÍSTICO, CULTURAL E ARQUITETÔNICO.ADEQUAR AS INSTALAÇÕES E OS ESPAÇOS FÍSICOS DOS BENS TOMBADOS, TORNANDO-AS ACESSÍVEIS PARA PESSOAS COM DEFICIÊNCIA, COM FOCO NA CONSERVAÇÃO E PRESERVAÇÃO. CONTRIBUIR PARA A PRESERVAÇÃO DO PATRIMÔNIO CULTURAL, POR MEIO DE AÇÕES DE CONSERVAÇÃO E RESTAURAÇÃO DE ACERVOS CULTURAIS.GARANTIR O ACESSO À INFORMAÇÃO, SEJA PARA DEFESA DE DIREITOS PARTICULARES E COLETIVOS OU PARA A PRODUÇÃO DO CONHECIMENTO CIENTÍFICO OU PARA CONSTRUÇÃO E DESENVOLVIMENTO DE POLÍTICAS PÚBLICAS.",,,,
2024,"INFRAESTRUTURA, MOBILIDADE E PARCERIAS",85,PROMOÇÃO DE CONCESSÕES E PARCERIAS,1301,"SECRETARIA DE ESTADO DE INFRAESTRUTURA, MOBILIDADE E PARCERIAS",PROMOÇÃO DE INVESTIMENTOS EM INFRAESTRUTURA E DA DISPONIBILIZAÇÃO DE SERVIÇOS E UTILIDADES PÚBLICAS POR MEIO DE PARCERIAS SUSTENTÁVEIS E EFICIENTES COM A INICIATIVA PRIVADA.,,,,
2024,"INFRAESTRUTURA, MOBILIDADE E PARCERIAS",117,"MOBILIDADE, TRANSPORTES E LOGÍSTICA",1301,"SECRETARIA DE ESTADO DE INFRAESTRUTURA, MOBILIDADE E PARCERIAS","PROMOVER O APRIMORAMENTO DO SISTEMA MOBILIDADE, TRANSPORTES E LOGÍSTICA, VISANDO PROPORCIONAR UMA INFRAESTRUTURA EFICIENTE, SUSTENTÁVEL E INTEGRADA QUE ATENDA ÀS NECESSIDADES DE DESLOCAMENTO DA POPULAÇÃO, OTIMIZE O FLUXO DE MERCADORIAS E ESTIMULE O DESENVOLVIMENTO SOCIOECONÔMICO DO ESTADO DE MINAS GERAIS.",,,,
2024,"INFRAESTRUTURA, MOBILIDADE E PARCERIAS",99,"DESENVOLVIMENTO DA INFRAESTRUTURA ESTADUAL, MUNICIPAL E REGIONAL",1301,"SECRETARIA DE ESTADO DE INFRAESTRUTURA, MOBILIDADE E PARCERIAS","DIRECIONAR INVESTIMENTOS PARA INFRAESTRUTURA VIÁRIA E PARA CONSTRUÇÃO, REFORMA E AMPLIAÇÃO DE EQUIPAMENTOS PÚBLICOS.",,,,
2024,"INFRAESTRUTURA, MOBILIDADE E PARCERIAS",77,CAMINHOS PARA O DESENVOLVIMENTO INTEGRADO METROPOLITANO,1301,"SECRETARIA DE ESTADO DE INFRAESTRUTURA, MOBILIDADE E PARCERIAS","PROMOVER IINICIATIVAS INOVADORAS PARA O DESENVOLVIMENTO INTEGRADO DAS REGIÕES METROPOLITANAS DE BELO HORIZONTE E DO VALE DO AÇO, COM  MELHORIA DO AMBIENTE EMPREENDEDOR E APOIO NA GERAÇÃO DE NOVOS NEGÓCIOS.",,,,
2024,MEIO AMBIENTE E DESENVOLVIMENTO SUSTENTÁVEL,21,SANEAMENTO E RESÍDUOS ESPECIAIS,1371,SECRETARIA DE ESTADO DE MEIO AMBIENTE E DESENVOLVIMENTO SUSTENTÁVEL,"ATUAR NO DESENVOLVIMENTO DE INSTRUMENTOS PARA A PROMOÇÃO DA MELHORIA DAS POLÍTICAS PÚBLICAS DE SANEAMENTO E GESTÃO DE RESÍDUOS, MEIO AMBIENTE, VISANDO À PRESERVAÇÃO E AO USO SUSTENTÁVEL DOS RECURSOS NATURAIS E HÍDRICOS, À PROMOÇÃO DO BEM-ESTAR SOCIAL E QUALIDADE DE VIDA.",,,,
2024,MEIO AMBIENTE E DESENVOLVIMENTO SUSTENTÁVEL,27,GESTÃO AMBIENTAL.,1371,SECRETARIA DE ESTADO DE MEIO AMBIENTE E DESENVOLVIMENTO SUSTENTÁVEL,"ATUAR NA IMPLANTAÇÃO DE POLÍTICAS PÚBLICAS PARA A PROMOÇÃO DA GESTÃO AMBIENTAL, EDUCAÇÃO AMBIENTAL E EDUCAÇÃO HUMANITÁRIA PARA O MANEJO ETICO, GUARDA RESPONSÁVEL, PROTEÇÃO E BEM-ESTAR DA FAUNA DOMÉSTICA, MELHORIA DA QUALIDADE AMBIENTAL POR MEIO DA GESTÃO DA QUALIDADE DO AR, DO  SOLO  E  DE  EFLUENTES  LÍQUIDOS  INDUSTRIAIS, BEM COMO PROMOVER A MITIGAÇÃO DE GASES DE EFEITO ESTUFA E A ADAPTAÇÃO AOS IMPACTOS CAUSADOS PELAS MUDANÇAS CLIMÁTICAS, VISANDO AO DESENVOLVIMENTO SUSTENTÁVEL E RESILIENTE ÀS MUDANÇAS CLIMÁTICAS, À TRANSIÇÃO PARA UMA ECONOMIA DE BAIXO CARBONO, À PRESERVAÇÃO E AO USO SUSTENTÁVEL DOS RECURSOS NATURAIS E HÍDRICOS, À PROMOÇÃO DO BEM-ESTAR SOCIAL E QUALIDADE DE VIDA.",,,,
2024,MEIO AMBIENTE E DESENVOLVIMENTO SUSTENTÁVEL,25,"MONITORAMENTO, CONTROLE E FISCALIZAÇÃO AMBIENTAL",1371,SECRETARIA DE ESTADO DE MEIO AMBIENTE E DESENVOLVIMENTO SUSTENTÁVEL,"PROPORCIONAR À POPULAÇÃO MINEIRA UMA FISCALIZAÇÃO AMBIENTAL MODERNA, EFICAZ E EFICIENTE, COM O PROPÓSITO DE PROTEGER E RESGUARDAR A QUALIDADE AMBIENTAL NO ESTADO.",,,,
2024,CORPO DE BOMBEIROS MILITAR DO ESTADO DE MINAS GERAIS,53,ATENDIMENTO PRÉ-HOSPITALAR,1401,CORPO DE BOMBEIROS MILITAR DO ESTADO DE MINAS GERAIS,"REDUÇÃO DA MORBIDADE E DA MORTALIDADE EVITÁVEIS POR MEIO DO APERFEIÇOAMENTO DO SISTEMA DE ATENDIMENTO A URGÊNCIAS E EMERGÊNCIAS PRÉ-HOSPITALARES, BUSCA E SALVAMENTO (ATENDIMENTO PRIMÁRIO), TRANSPORTE INTER-HOSPITALAR (ATENDIMENTO SECUNDÁRIO), TRANSPORTE DE ÓRGÃOS E TECIDOS PARA TRANSPLANTES E APOIO À FORÇA ESTADUAL DE SAÚDE DO ESTADO DE MINAS GERAIS. ",,,,
2024,DEFENSORIA PÚBLICA,726,ACESSO À JUSTIÇA,1441,DEFENSORIA PUBLICA DO ESTADO DE MINAS GERAIS,"PROMOVER, COMO EXPRESSÃO E INSTRUMENTO DO REGIME DEMOCRÁTICO, FUNDAMENTALMENTE, O ACESSO À JUSTIÇA COM A ORIENTAÇÃO JURÍDICA, A PROMOÇÃO DOS DIREITOS HUMANOS E A DEFESA, EM TODOS OS GRAUS, JUDICIAL E EXTRAJUDICIAL, DOS DIREITOS INDIVIDUAIS E COLETIVOS, DE FORMA INTEGRAL E GRATUITA, AOS NECESSITADOS, NA FORMA DO INCISO LXXIV DO ART. 5º DA CONSTITUIÇÃO FEDERAL.",,,,
2024,JUSTIÇA E SEGURANÇA PÚBLICA,134,GESTÃO INTEGRADA DE SEGURANÇA PÚBLICA,1451,SECRETARIA DE ESTADO DE JUSTIÇA E SEGURANÇA PÚBLICA,"PROMOVER A QUALIDADE DA ATUAÇÃO E INTEGRAÇÃO DE AÇÕES E INFORMAÇÕES DO SISTEMA DE SEGURANÇA PÚBLICA, OBJETIVANDO A REDUÇÃO DA INCIDÊNCIA DE CRIMES, CONTRAVENÇÕES, VIOLÊNCIAS, ACIDENTES E VIOLAÇÕES DE DIREITOS.",,,,
2024,JUSTIÇA E SEGURANÇA PÚBLICA,129,PREVENÇÃO À CRIMINALIDADE,1451,SECRETARIA DE ESTADO DE JUSTIÇA E SEGURANÇA PÚBLICA,"CONTRIBUIR PARA PREVENÇÃO E REDUÇÃO DE VIOLÊNCIAS E CRIMINALIDADES INCIDENTES SOBRE DETERMINADOS TERRITÓRIOS E GRUPOS MAIS VULNERÁVEIS A ESSES FENÔMENOS, CONSOLIDAR A FILOSOFIA DE POLICIAMENTO COMUNITÁRIO, PREVENÇÃO ATIVA E SEGURANÇA CIDADÃ, E CONTRIBUIR PARA O AUMENTO DA SENSAÇÃO DE SEGURANÇA NO ESTADO DE MINAS GERAIS.",,,,
2024,JUSTIÇA E SEGURANÇA PÚBLICA,130,INFRAESTRUTURA DO SISTEMA PRISIONAL,1451,SECRETARIA DE ESTADO DE JUSTIÇA E SEGURANÇA PÚBLICA,"GARANTIR A ADEQUAÇÃO DO CONJUNTO DE INSTALAÇÕES, EQUIPAMENTOS E SERVIÇOS PARA OSISTEMA PRISIONAL, DE FORMA A PROVER UMA CUSTÓDIA MAIS HUMANIZADA E CONDIÇÕES DETRABALHO APROPRIADAS AOS POLICIAIS PENAIS/AGENTES DE SEGURANÇA PENITENCIÁRIA, ANALISTAS,ASSISTENTES E DEMAIS PROFISSIONAIS, IMPACTANDO POSITIVAMENTE, POR FIM, OS ÍNDICES DERESSOCIALIZAÇÃO.",,,,
2024,JUSTIÇA E SEGURANÇA PÚBLICA,146,PROMOÇÃO DA POLÍTICA SOCIOEDUCATIVA PARA ATENDIMENTO AOS ADOLESCENTES EM CONFLITO COM A LEI,1451,SECRETARIA DE ESTADO DE JUSTIÇA E SEGURANÇA PÚBLICA,"OFERTAR ATENDIMENTO QUALIFICADO AOS ADOLESCENTES EM CUMPRIMENTO DE MEDIDA SOCIOEDUCATIVA, PROMOVENDO A RESPONSABILIZAÇÃO, O ACESSO A DIREITOS E A REINSERÇÃO SOCIAL, CONTRIBUINDO PARA O ROMPIMENTO DA TRAJETÓRIA INFRACIONAL E PARA A REDUÇÃO DOS ÍNDICES DE VIOLÊNCIA E DE CRIMINALIDADE.",,,,
2024,JUSTIÇA E SEGURANÇA PÚBLICA,141,POLÍTICAS SOBRE DROGAS,1451,SECRETARIA DE ESTADO DE JUSTIÇA E SEGURANÇA PÚBLICA,"PLANEJAR, COORDENAR E SUPERVISIONAR A IMPLEMENTAÇÃO DE POLÍTICAS SOBRE DROGAS EM MINAS GERAIS, FOMENTANDO  A DESCENTRALIZAÇÃO DE AÇÕES DE  PREVENÇÃO,  ATENÇÃO,  CUIDADO,  TRATAMENTO,  APOIO,  MÚTUA AJUDA E  REINSERÇÃO SOCIAL E ECONÔMICA DE PESSOAS COM DEPENDÊNCIA DE DROGAS LÍCITAS E ILÍCITAS, PROMOVENDO A FORMAÇÃO  E  O LEVANTAMENTO DE DADOS BASEADOS EM EVIDÊNCIAS CIENTÍFICAS, ARTICULANDO E FORTALECENDO A ATUAÇÃO DE REDES GOVERNAMENTAIS E NÃO GOVERNAMENTAIS E REALIZANDO A GESTÃO DE ATIVOS PERDIDOS E APREENDIDOS EM FAVOR DA UNIÃO EM DECORRÊNCIA DO TRÁFICO DE DROGAS.",,,,
2024,DESENVOLVIMENTO SOCIAL,148,APOIO ÀS POLÍTICAS DE DESENVOLVIMENTO SOCIAL,1481,SECRETARIA DE ESTADO DE DESENVOLVIMENTO SOCIAL,"PROMOVER A EFICÁCIA DE CONVÊNIOS E PARCERIAS, DESDE A CELEBRAÇÃO, ATRAVÉS DA EXECUÇÃO, MONITORAMENTO, PRESTAÇÃO DE CONTAS, BAIXA CONTÁBIL, BEM COMO NA RECUPERAÇÃO DE DANO AO ERÁRIO CONTRIBUINDO PARA A BOA E REGULAR UTILIZAÇÃO DOS RECURSOS PÚBLICOS E DESENVOLVIMENTO DAS POLÍTICAS PÚBLICAS VINCULADAS A SEDESE, MEDIANTE APOIO ÀS ORGANIZAÇÕES DA SOCIEDADE CIVIL SEM FINS LUCRATIVOS E OS MUNICÍPIOS NO DESENVOLVIMENTO DE AÇÕES DE INFRAESTRUTURA, AQUISIÇÃO DE BENS, MANUTENÇÃO E MELHORIA DE ATIVIDADES, COM VISTAS A MINIMIZAR VULNERABILIDADES SOCIAIS E ENFRENTAMENTO À POBREZA.",,,,
2024,DESENVOLVIMENTO SOCIAL,86,POLÍTICA DOS DIREITOS DAS MULHERES,1481,SECRETARIA DE ESTADO DE DESENVOLVIMENTO SOCIAL,"PROMOVER, DEFENDER E GARANTIR OS DIREITOS DAS MULHERES E A IGUALDADE DE GÊNERO, COM A  OFERTA DE QUALIFICAÇÃO PROFISSIONAL, VISANDO AÇÕES DE INCLUSÃO PRODUTIVA, GERAÇÃO DE TRABALHO, EMPREGO E RENDA, BEM COMO O ENFRENTAMENTO DA VIOLÊNCIA DOMÉSTICA E INTRAFAMILIAR.",,,,
2024,DESENVOLVIMENTO SOCIAL,83,POLÍTICAS DE PROMOÇÃO AO DESENVOLVIMENTO SOCIAL NO CONTEXTO RURAL - PERCURSOS GERAIS: TRAJETÓRIA PARA AUTONOMIA,1481,SECRETARIA DE ESTADO DE DESENVOLVIMENTO SOCIAL,"COORDENAR E FOMENTAR ESTRATÉGIAS DE PROMOÇÃO DO DESENVOLVIMENTO SOCIAL DE FAMÍLIAS E COMUNIDADES, POR MEIO DO GERENCIAMENTO DE POLÍTICAS PÚBLICAS INTERSETORIAIS FOCALIZADAS EM MUNICÍPIOS VULNERÁVEIS DA REGIÃO DA SUDENE. ",,,,
2024,DESENVOLVIMENTO SOCIAL,84,"POLÍTICAS DE INTEGRAÇÃO, REGIONALIZAÇÃO E INOVAÇÃO",1481,SECRETARIA DE ESTADO DE DESENVOLVIMENTO SOCIAL,"PROMOVER E ORIENTAR A REGIONALIZAÇÃO E INTEGRAÇÃO DOS PROGRAMAS, PROJETOS E AÇÕES, FOMENTAR A ELABORAÇÃO DE POLÍTICAS PÚBLICAS BASEADAS EM EVIDÊNCIAS, FORNECER DIRETRIZES PARA GESTÃO DE DADOS NO  MBITO DA SEDESE, PROMOVER A INCUBAÇÃO DE PROJETOS E APOIAR O DESENVOLVIMENTO DE INICIATIVAS ESTRATÉGICAS E INOVADORAS, VISANDO AO DESENVOLVIMENTO SOCIAL DAS DIFERENTES REGIÕES DO ESTADO.",,,,
2024,DESENVOLVIMENTO SOCIAL,66,POLÍTICAS DE TRABALHO E EMPREGO,1481,SECRETARIA DE ESTADO DE DESENVOLVIMENTO SOCIAL,"CONTRIBUIR PARA A REDUÇÃO DAS VULNERABILIDADES DA POPULAÇÃO DE MINAS GERAIS NO ASPECTO RENDA, FACILITANDO SUA INCLUSÃO PRODUTIVA, SEJA POR MEIO DE EMPREGO FORMAL, EMPREENDEDORISMO OU ECONOMIA POPULAR SOLIDÁRIA.",,,,
2024,DESENVOLVIMENTO SOCIAL,67,REDE DE DESENVOLVIMENTO DA EDUCAÇÃO PROFISSIONAL,1481,SECRETARIA DE ESTADO DE DESENVOLVIMENTO SOCIAL,"PROMOVER O AUMENTO DA EMPREGABILIDADE, DA PRODUTIVIDADE, DO EMPREENDEDORISMO E DA CAPACIDADE DE INOVAÇÃO DOS CIDADÃOS DO ESTADO DE MINAS GERAIS, POR MEIO DA ARTICULAÇÃO E COORDENAÇÃO DAS AÇÕES DE INCLUSÃO PRODUTIVA NO MUNDO DO TRABALHO E DE QUALIFICAÇÃO PROFISSIONAL ORIENTADAS POR EVIDÊNCIAS, PRIORIZANDO PÚBLICOS EM SITUAÇÃO DE VULNERABILIDADE SOCIAL, INCLUSIVE A POPULAÇÃO TRANS EM SITUAÇÃO DE RUA.",,,,
2024,DESENVOLVIMENTO SOCIAL,69,"FOMENTO AO ESPORTE, À ATIVIDADE FÍSICA E AO LAZER",1481,SECRETARIA DE ESTADO DE DESENVOLVIMENTO SOCIAL,"ESTIMULAR O DESENVOLVIMENTO DE ATIVIDADES FÍSICAS, ESPORTIVAS E DE LAZER EM MINAS GERAIS, CONTRIBUINDO PARA A REDUÇÃO DA VULNERABILIDADE SOCIAL, A MELHORIA DA QUALIDADE DE VIDA DA POPULAÇÃO, O DESENVOLVIMENTO DE HÁBITOS SAUDÁVEIS E O FORTALECIMENTO DA IMAGEM DO ESTADO NOS CENÁRIOS ESPORTIVOS NACIONAL E INTERNACIONAL.",,,,
2024,DESENVOLVIMENTO SOCIAL,70,POLÍTICAS DE DIREITOS HUMANOS,1481,SECRETARIA DE ESTADO DE DESENVOLVIMENTO SOCIAL,"PROMOVER, PROTEGER E GARANTIR OS DIREITOS HUMANOS DE TODOS POR MEIO DE ARTICULAÇÃO, IMPLEMENTAÇÃO E MONITORAMENTO DE POLÍTICAS PÚBLICAS, , COM ESPECIAL ATENÇÃO ÀS LIBERDADES INDIVIDUAIS.",,,,
2024,DESENVOLVIMENTO SOCIAL,73,MORADAS GERAIS,1481,SECRETARIA DE ESTADO DE DESENVOLVIMENTO SOCIAL,"APOIAR OS MUNICÍPIOS NA IMPLEMENTAÇÃO DE POLÍTICAS HABITACIONAIS, ALINHADAS AO PLANO ESTADUAL DE HABITAÇÃO DE INTERESSE SOCIAL (PEHIS/MG) E À LEGISLAÇÃO VIGENTE FORMULAR PROGRAMAS, ESTABELECER DIRETRIZES E DEFINIR ESTRATÉGIAS PARA O ENFRENTAMENTO AO DÉFICIT HABITACIONAL E À INADEQUAÇÃO DE MORADIAS DO ESTADO, ALÉM DE PROPOR AÇÕES PARA VIABILIZAR E PROMOVER PARCERIAS INTERFEDERATIVAS, DE INCENTIVO A PROGRAMAS DE INVESTIMENTOS E SUBSÍDIOS, PARA O ACESSO À HABITAÇÃO URBANA E/OU RURAL, ADEQUADA E SUSTENTÁVEL, PRIORIZANDO PÚBLICOS VULNERÁVEIS.",,,,
2024,DESENVOLVIMENTO SOCIAL,74,SEGURANÇA ALIMENTAR E NUTRICIONAL SUSTENTÁVEL PARA TODOS OS POVOS DO TERRITÓRIO MINEIRO,1481,SECRETARIA DE ESTADO DE DESENVOLVIMENTO SOCIAL,"DESENVOLVER, ASSESSORAR, E APOIAR POLÍTICAS PÚBLICAS DE SEGURANÇA ALIMENTAR E NUTRICIONAL POR MEIO DO FOMENTO E FORTALECIMENTO DOS EQUIPAMENTOS PÚBLICOS DE SAN, DO SISTEMA NACIONAL DE SEGURANÇA ALIMENTAR E NUTRICIONAL (SISAN) E DA PARTICIPAÇÃO SOCIAL NO ESTADO DE MINAS GERAIS A FIM DE MITIGAR A FOME E A VULNERABILIDADE ALIMENTAR E NUTRICIONAL NOS MUNICÍPIOS MINEIROS CONSIDERANDO A INTERSETORIALIDADE DA TEMÁTICA DE SAN, A SOBERANIA ALIMENTAR, A AGROECOLOGIA, O DIREITO HUMANO À ALIMENTAÇÃO ADEQUADA E O RESPEITO À TERRITORIALIDADE, REGIONALIDADE, CULTURA ALIMENTAR E AUTONOMIA MUNICIPAL.",,,,
2024,GOVERNO,109,GESTÃO DE CERIMONIAL E EVENTOS,1491,SECRETARIA DE ESTADO DE GOVERNO,"PROMOVER O RELACIONAMENTO VIRTUOSO COM OS ATORES ESTRATÉGICOS DA SOCIEDADE, DOS GOVERNOS FEDERAIS, ESTADUAIS, MUNICIPAIS E MEIOS DE COMUNICAÇÕES, AMPLIANDO O ACESSO ÀS INFORMAÇÕES DE INTERESSE PÚBLICO E VEICULANDO A VISÃO DE GOVERNO POR MEIO DA GESTÃO DE CERIMONIAL E EVENTOS.",,,,
2024,GOVERNO,115,GESTÃO DO PROCESSO LEGISLATIVO ESTADUAL SOB A RESPONSABILIDADE DO PODER EXECUTIVO,1491,SECRETARIA DE ESTADO DE GOVERNO,"OPERACIONALIZAR O EXERCÍCIO DOS DEVERES CONSTITUCIONAIS DO PODER EXECUTIVO NO ÂMBITO DO PROCESSO LEGISLATIVO ESTADUAL, COM RESPEITO À AUTONOMIA E PROMOÇÃO À HARMONIA ENTRE OS PODERES PREVISTA NO ART. 2º DA CONSTITUIÇÃO FEDERAL.",,,,
2024,GOVERNO,119,APOIO AO DESENVOLVIMENTO MUNICIPAL E À COORDENAÇÃO DAS TRANSFERÊNCIAS ESTADUAIS DE RECURSOS FINANCEIROS,1491,SECRETARIA DE ESTADO DE GOVERNO,"ESTIMULAR O DESENVOLVIMENTO SOCIOECONÔMICO NOS MUNICÍPIOS MINEIROS DE FORMA SUSTENTÁVEL, ATENDENDO PRINCIPALMENTE A ADMINISTRAÇÃO PÚBLICA MUNICIPAL, OS CONSÓRCIOS PÚBLICOS INTERMUNICIPAIS, E AS ORGANIZAÇÕES DA SOCIEDADE CIVIL, POR MEIO DA TRANSFERÊNCIA VOLUNTÁRIA DE RECURSOS FINANCEIROS, DO APOIO TÉCNICO E DO MONITORAMENTO E DA FISCALIZAÇÃO DESSAS TRANSFERÊNCIAS, VISANDO A REALIZAÇÃO DE OBRAS DE INFRAESTRUTURA URBANA E RURAL E A AQUISIÇÃO DE BENS MÓVEIS, EM DIÁLOGO COM A ASSEMBLEIA LEGISLATIVA DO ESTADO DE MINAS GERAIS E OBSERVANDO AS DIVERSIDADES E POTENCIALIDADES LOCAIS, COORDENAR O FLUXO DE TRANSFERÊNCIAS VOLUNTÁRIAS EFETUADAS PELO ESTADO DE MINAS GERAIS, ARTICULAR EM CONJUNTO COM A COMISSÃO DE PARTICIPAÇÃO POPULAR DA ASSEMBLEIA LEGISLATIVA DO ESTADO DE MINAS GERAIS O ATENDIMENTO DE PLEITOS DA SOCIEDADE CIVIL.",,,,
2024,GOVERNO,120,PRODUÇÃO E VEICULAÇÃO DO DIÁRIO OFICIAL ELETRÔNICO MINAS GERAIS,1491,SECRETARIA DE ESTADO DE GOVERNO,"O PROGRAMA TEM POR OBJETIVO ASSEGURAR A CONTÍNUA PRODUÇÃO E VEICULAÇÃO DO DIÁRIO OFICIAL ELETRÔNICO MINAS GERAIS (DOMG-E), PREZANDO PELO APERFEIÇOAMENTO DA RELAÇÃO EXISTENTE ENTRE AS ATIVIDADES PRESTADAS PELA SUPERINTENDÊNCIA DE GESTÃO DO DIÁRIO OFICIAL (SGDOF) E AS NECESSIDADES DOS USUÁRIOS DO SERVIÇO DE PUBLICIDADE OFICIAL, PELA OTIMIZAÇÃO E SIMPLIFICAÇÃO DO PROCESSO DE PUBLICAÇÃO DE MATÉRIAS, PELA AMPLIAÇÃO DO ACESSO ÀS INFORMAÇÕES PUBLICADAS AO LONGO DE TODA A EXISTÊNCIA DO DOMG-E, CUJA PRIMEIRA EDIÇÃO DATA DE 21 DE ABRIL DE 1892, E PELA PRESERVAÇÃO DO ACERVO FÍSICO DO DOMG-E PRODUZIDO ENTRE 04/1892 A 03/2019.",,,,
2024,GOVERNO,122,FORTALECIMENTO DA GESTÃO DAS TRANSFERÊNCIAS ESTADUAIS,1491,SECRETARIA DE ESTADO DE GOVERNO,IMPLEMENTAR AÇÕES DIRECIONADAS À MANUTENÇÃO E MELHORIA CONTÍNUA DOS PROCEDIMENTOS NORMATIVOS E SISTEMAS DE INFORMAÇÃO DE FORMA A FORTALECER O PROCESSO DE GESTÃO DAS TRANSFERÊNCIAS ESTADUAIS NO ÂMBITO DO GOVERNO DE MINAS GERAIS.,,,,
2024,PLANEJAMENTO E GESTÃO,149,TRANSFORMAÇÃO DIGITAL E ATENDIMENTO AO CIDADÃO,1501,SECRETARIA DE ESTADO DE PLANEJAMENTO E GESTÃO,"FORMULAR E COORDENAR A IMPLEMENTAÇÃO DA ESTRATÉGIA DE GOVERNO DIGITAL DA ADMINISTRAÇÃO PÚBLICA ESTADUAL, ESTABELECER POLÍTICAS PÚBLICAS PARA GOVERNANÇA ELETRÔNICA PARA AUMENTAR A EFICIÊNCIA DA GESTÃO PÚBLICA ESTADUAL, COORDENAR A OPERAÇÃO E IMPLANTAÇÃO DOS SISTEMAS CORPORATIVOS DE PLANEJAMENTO E GESTÃO, COORDENAR A OPERAÇÃO E IMPLANTAÇÃO DOS SISTEMAS DE GESTÃO DE TRÂNSITO E MELHORAR A EXPERIÊNCIA DOS USUÁRIOS COM OS SERVIÇOS PÚBLICOS, UTILIZANDO UMA ABORDAGEM DE INOVAÇÃO QUE INTEGRE O ATENDIMENTO FÍSICO E O DIGITAL E MODERNIZAÇÃO DOS PROCESSOS DE TRABALHO E DOS SERVIÇOS PÚBLICOS.",,,,
2024,PLANEJAMENTO E GESTÃO,155,REPARAÇÃO DOS DANOS DOS ROMPIMENTOS EM BRUMADINHO E MARIANA,1501,SECRETARIA DE ESTADO DE PLANEJAMENTO E GESTÃO,"PROMOVER AÇÕES SETORIAIS E INTERSETORIAIS PARA A RECUPERAÇÃO SOCIOECONÔMICA E SOCIOAMBIENTAL DOS MUNICÍPIOS ATINGIDOS PELO ROMPIMENTO DA BARRAGEM I, IV E IV-A DA MINA DO CÓRREGO DO FEIJÃO EM BRUMADINHO E DA BARRAGEM DO FUNDÃO EM MARIANA.",,,,
2024,PLANEJAMENTO E GESTÃO,156,GESTÃO DA CIDADE ADMINISTRATIVA,1501,SECRETARIA DE ESTADO DE PLANEJAMENTO E GESTÃO,"PLANEJAR, GERIR, NORMATIZAR E EXECUTAR AS ATIVIDADES NECESSÁRIAS À OPERAÇÃO DA CIDADE ADMINISTRATIVA ""PRESIDENTE TANCREDO DE ALMEIDA NEVES"", BEM COMO A GESTÃO DE SEUS BENS E SERVIÇOS, COM VISTAS À OTIMIZAÇÃO LOGÍSTICO-OPERACIONAL E À MELHORIA DA QUALIDADE DO GASTO PÚBLICO.",,,,
2024,PLANEJAMENTO E GESTÃO,157,GESTÃO DO PLANEJAMENTO ORÇAMENTÁRIO GOVERNAMENTAL,1501,SECRETARIA DE ESTADO DE PLANEJAMENTO E GESTÃO,"PROMOVER A EFICIÊNCIA E A INTEGRAÇÃO DA AÇÃO GOVERNAMENTAL ATRAVÉS DA COORDENAÇÃO E GESTÃO DO PROCESSO DE ELABORAÇÃO DOS INSTRUMENTOS DE PLANEJAMENTO ORÇAMENTÁRIO DO GOVERNO, DOS CONTRATOS DE GESTÃO E TERMOS DE PARCERIAS. TODAS AS INCIATIVAS ESTÃO ORIENTADAS PARA A QUALIDADE DO GASTO, SUSTENTABILIDADE, CELERIDADE, TRANSPARÊNCIA E ATENDIMENTO DAS NECESSIDADES DOS CIDADÃOS MINEIROS.",,,,
2024,PLANEJAMENTO E GESTÃO,159,CENTRALIZAÇÃO DO PROCESSAMENTO DE COMPRAS PÚBLICAS,1501,SECRETARIA DE ESTADO DE PLANEJAMENTO E GESTÃO,"AUMENTAR A QUALIDADE DO GASTO PÚBLICO E APRIMORAR O CONTROLE E RESULTADOS DOS PROCESSOS POR MEIO DA GESTÃO, OPERACIONALIZAÇÃO E APERFEIÇOAMENTO DO PROCESSAMENTO CENTRALIZADO DAS COMPRAS E CONTRATAÇÕES DE BENS E SERVIÇOS UTILIZADOS PELOS ÓRGÃOS E ENTIDADES DO ESTADO.",,,,
2024,PLANEJAMENTO E GESTÃO,160,MELHORIA DA GESTÃO LOGÍSTICA E PATRIMONIAL,1501,SECRETARIA DE ESTADO DE PLANEJAMENTO E GESTÃO,"OFERECER POLÍTICAS E AÇÕES DE GESTÃO LOGÍSTICA E PATRIMONIAL QUE PROMOVAM A EFETIVIDADE DAS OPERAÇÕES E A MELHOR APLICAÇÃO DOS ATIVOS PÚBLICOS, APOIANDO A REALIZAÇÃO DE POLÍTICAS PÚBLICAS NO ÂMBITO DA ADMINISTRAÇÃO PÚBLICA ESTADUAL.",,,,
2024,PLANEJAMENTO E GESTÃO,161,GESTÃO DE TRÂNSITO,1501,SECRETARIA DE ESTADO DE PLANEJAMENTO E GESTÃO,"MODERNIZAR E SIMPLIFICAR OS SERVIÇOS DE TRÂNSITO, POR MEIO DA TECNOLOGIA E DESBUROCRATIZAÇÃO DE PROCESSOS,  EXPANDIR A OFERTA E DISPONIBILIDADE DOS SERVIÇOS DE TRÂNSITO À SOCIEDADE MINEIRA, POR MEIO DA INTEGRAÇÃO DOS SERVIÇOS NAS UNIDADES DE ATENDIMENTO INTEGRADO (UAI), DISPONIBILIZAÇÃO DE CANAIS VIRTUAIS E CREDENCIAMENTO DE PARCEIROS, AMPLIAR O USO DE TECNOLOGIAS PARA AGILIDADE E DISPONIBILIDADE DO ATENDIMENTO AO CIDADÃO, FORNECER ESTATÍSTICAS E ORIENTAR A ATIVIDADE DE TRÂNSITO NO ESTADO DE MINAS GERAIS PARA AS ÁREAS DE ENGENHARIA DE TRÁFEGO, EDUCAÇÃO PARA O TRÂNSITO E CONTROLE DE VEÍCULOS E CONDUTORES. ALOCAR DE FORMA EFICIENTE OS RECURSOS PÚBLICOS PARA CUMPRIMENTO DAS POLÍTICAS DE TRÂNSITO NO ESTADO DE MINAS GERAIS.",,,,
2024,PLANEJAMENTO E GESTÃO,147,GESTÃO DE PESSOAS,1501,SECRETARIA DE ESTADO DE PLANEJAMENTO E GESTÃO,"PROMOVER AÇÕES PARA MODERNIZAÇÃO DA POLÍTICA DE GESTÃO DE PESSOAS NO ÂMBITO DA ADMINISTRAÇÃO PÚBLICA DIRETA, AUTÁRQUICA E FUNDACIONAL DO PODER EXECUTIVO, DESDE A SELEÇÃO (INGRESSO) ATÉ A APOSENTADORIA/DESLIGAMENTO DO SERVIDOR.",,,,
2024,PLANEJAMENTO E GESTÃO,151,PROMOÇÃO DA INOVAÇÃO E DA GESTÃO ESTRATÉGICA,1501,SECRETARIA DE ESTADO DE PLANEJAMENTO E GESTÃO,"PROMOVER A INOVAÇÃO E A GESTÃO ESTRATÉGICA NO PODER EXECUTIVO ESTADUAL, POR MEIO DA DESBUROCRATIZAÇÃO DOS PROCESSOS DE TRABALHO, DA TRANSFORMAÇÃO DOS SERVIÇOS PÚBLICOS COM FOCO NO USUÁRIO, DO ACOMPANHAMENTO DOS PROJETOS ESTRATÉGICOS DE GOVERNO E DA ARTICULAÇÃO PARA IMPLANTAÇÃO DE MEDIDAS RESOLUTIVAS NECESSÁRIAS PARA O ALCANCE DOS SEUS RESULTADOS.",,,,
2024,PLANEJAMENTO E GESTÃO,705,APOIO ÀS POLÍTICAS PÚBLICAS,1501,SECRETARIA DE ESTADO DE PLANEJAMENTO E GESTÃO,"DESENVOLVER ATIVIDADES DE SUPORTE À CONSECUÇÃO DAS POLITICAS PÚBLICAS DOS ÓRGÃOS E ENTIDADES GOVERNAMENTAIS, EM RELAÇÃO ÀS QUAIS NÃO SE POSSA ASSOCIAR UM BEM OU SERVIÇO A SER DISPONIBILIZADO DIRETAMENTE À SOCIEDADE.",,,,
2024,POLÍCIA CIVIL DO ESTADO DE MINAS GERAIS,36,IDENTIFICAÇÃO CIVIL E CRIMINAL,1511,POLÍCIA CIVIL DO ESTADO DE MINAS GERAIS,"TEM POR PRINCIPAL OBJETIVO PROMOVER A IDENTIFICAÇÃO CIVIL E CRIMINAL NO ÂMBITO DO ESTADO DE MINAS GERAIS, POR MEIO DA EMISSÃO DE CARTEIRA DE IDENTIDADE, ATESTADO DE ANTECEDENTES CRIMINAIS (INCLUEM-SE OS EMITIDOS VIA TOTEM E EXCLUEM-SE OS VIA WEB), LAUDOS, PARECERES, MANDADOS DE PRISÃO E ALVARÁS DE SOLTURA. COMO OBJETIVO SECUNDÁRIO TEM-SE A MODERNIZAÇÃO DA IDENTIFICAÇÃO CIVIL E CRIMINAL, VISANDO MAIOR CELERIDADE E QUALIDADE NO PROCESSO DE IDENTIFICAÇÃO, COM O INTUITO DE AMPLIAR A ELUCIDAÇÃO DE CRIMES POR MEIO DE UM CONFRONTO PAPILOSCÓPICO MAIS EFETIVO.",,,,
2024,POLÍCIA CIVIL DO ESTADO DE MINAS GERAIS,37,VALORIZAÇÃO E SAÚDE DO SERVIDOR,1511,POLÍCIA CIVIL DO ESTADO DE MINAS GERAIS,"PROPORCIONAR ACESSO A SERVIÇOS DE SAÚDE, ENSINO DE QUALIDADE AOS SERVIDORES DA POLICIA CIVIL E SEUS DEPENDENTES. VALORIZAR E CAPACITAR OS SERVIDORES DA POLICIA CIVIL PARA UM MELHOR DESEMPENHO DAS FUNÇÕES POLICIAIS E ADMINISTRATIVAS. FORTALECER O COLÉGIO ORDEM E PROGRESSO PARA OFERTAR ENSINO DE EXCELÊNCIA AOS FAMILIARES DOS SERVIDORES DA POLÍCIA CIVIL APRIMORAR AÇÕES DE PREVENÇÃO E PROMOÇÃO À SAÚDE FÍSICA E MENTAL DOS SERVIDORES DA INSTITUIÇÃO, POR MEIO DA IMPLEMENTAÇÃO DA EFETIVA DA DIRETORIA DE SAÚDE OCUPACIONAL E A ELABORAÇÃO DOS PROGRAMAS DE PREVENÇÃO DE RISCOS AMBIENTAIS (PPRA) E DE CONTROLE MÉDICO DE SAÚDE OCUPACIONAL (PCMSO). OTIMIZAR CORPO CLÍNICO E ASSISTENCIAL ATRAVÉS DA OFERTA DE CURSOS DE CAPACITAÇÃO E APERFEIÇOAMENTO PARA PROFISSIONAIS DA SAÚDE POSSIBILITANDO UMA ASSISTÊNCIA MAIS QUALIFICADA. AMPLIAR O QUADRO DE RECURSOS HUMANOS DO HOSPITAL DA POLÍCIA CIVIL DO ESTADO DE MINAS GERAIS, ATRAVÉS DA REALIZAÇÃO DE CONCURSO PÚBLICO, PARA AUMENTAR A CAPACIDADE DE ATENDIMENTO DOS SERVIDORES E DEPENDENTES, PRINCIPALMENTE NA ÁREA MÉDICA.",,,,
2024,POLÍCIA CIVIL DO ESTADO DE MINAS GERAIS,32,INVESTIGAÇÃO,1511,POLÍCIA CIVIL DO ESTADO DE MINAS GERAIS,AMPLIAR A SEGURANÇA E A SENSAÇÃO DE SEGURANÇA NO TERRITÓRIO DE MINAS GERAIS. ,,,,
2024,CONTROLADORIA GERAL,1,MINAS ÍNTEGRA E TRANSPARENTE,1521,CONTROLADORIA-GERAL DO ESTADO,"CONTRIBUIR PARA O APRIMORAMENTO DA GESTÃO PÚBLICA A PARTIR DA DISSEMINAÇÃO DE BOAS PRÁTICAS DE TRANSPARÊNCIA, DE CONTROLE SOCIAL E DE INTEGRIDADE ENTRE OS AGENTES PÚBLICOS E OS DEMAIS ATORES QUE SE RELACIONAM COM O GOVERNO DO ESTADO DE MINAS GERAIS.",,,,
